{
  "schemaVersion": 1,
  "id": "fixture-0600",
  "label": "Before incident",
  "takenAt": "2026-10-11T06:00:00Z",
  "source": "fixture",
  "isSimulated": true,
  "data": {
    "environments": [
      {
        "id": "production",
        "name": "Production",
        "kind": "production"
      },
      {
        "id": "staging",
        "name": "Staging",
        "kind": "staging"
      },
      {
        "id": "development",
        "name": "Development",
        "kind": "development"
      }
    ],
    "serviceDefinitions": [
      {
        "id": "api-gateway",
        "name": "API Gateway",
        "description": "Public ingress; routes and authenticates external traffic.",
        "owner": "Platform",
        "team": "Platform Edge",
        "category": "gateway",
        "protocols": [
          "https",
          "grpc"
        ]
      },
      {
        "id": "web-bff",
        "name": "Web BFF",
        "description": "Backend-for-frontend aggregating storefront calls.",
        "owner": "Commerce",
        "team": "Storefront",
        "category": "api",
        "protocols": [
          "http",
          "grpc"
        ]
      },
      {
        "id": "auth-service",
        "name": "Auth Service",
        "description": "Session and token issuance.",
        "owner": "Platform",
        "team": "Identity",
        "category": "api",
        "protocols": [
          "grpc",
          "redis"
        ]
      },
      {
        "id": "cart-service",
        "name": "Cart Service",
        "description": "Shopping cart state.",
        "owner": "Commerce",
        "team": "Storefront",
        "category": "api",
        "protocols": [
          "grpc",
          "redis"
        ]
      },
      {
        "id": "catalog-service",
        "name": "Catalog Service",
        "description": "Product catalog reads and search.",
        "owner": "Commerce",
        "team": "Catalog",
        "category": "api",
        "protocols": [
          "http",
          "grpc",
          "kafka"
        ]
      },
      {
        "id": "order-service",
        "name": "Order Service",
        "description": "Order placement and lifecycle; publishes order events.",
        "owner": "Commerce",
        "team": "Orders",
        "category": "api",
        "protocols": [
          "https",
          "grpc",
          "postgresql",
          "kafka"
        ]
      },
      {
        "id": "inventory-service",
        "name": "Inventory Service",
        "description": "Stock levels and reservations.",
        "owner": "Commerce",
        "team": "Fulfilment",
        "category": "api",
        "protocols": [
          "grpc",
          "postgresql",
          "kafka"
        ]
      },
      {
        "id": "notification-service",
        "name": "Notification Service",
        "description": "Turns order events into customer notifications.",
        "owner": "Commerce",
        "team": "Engagement",
        "category": "worker",
        "protocols": [
          "kafka",
          "rabbitmq"
        ]
      },
      {
        "id": "email-dispatcher",
        "name": "Email Dispatcher",
        "description": "Consumes the email queue and calls the email delivery provider.",
        "owner": "Commerce",
        "team": "Engagement",
        "category": "worker",
        "protocols": [
          "rabbitmq",
          "https"
        ]
      },
      {
        "id": "legacy-report-cron",
        "name": "Legacy Report Cron",
        "description": "Nightly order export for finance. Owner unassigned.",
        "category": "scheduled-job",
        "protocols": [
          "postgresql"
        ]
      },
      {
        "id": "payment-service",
        "name": "Payment Service",
        "description": "Payment authorization and capture.",
        "owner": "Payments",
        "team": "Payments",
        "category": "api",
        "protocols": [
          "grpc",
          "https",
          "postgresql",
          "kafka"
        ]
      },
      {
        "id": "fraud-scoring",
        "name": "Fraud Scoring",
        "description": "Real-time risk scoring for payment attempts.",
        "owner": "Payments",
        "team": "Risk",
        "category": "api",
        "protocols": [
          "grpc"
        ]
      },
      {
        "id": "ledger-service",
        "name": "Ledger Service",
        "description": "Double-entry ledger fed by payment events.",
        "owner": "Payments",
        "team": "Payments",
        "category": "worker",
        "protocols": [
          "kafka",
          "postgresql"
        ]
      },
      {
        "id": "payout-worker",
        "name": "Payout Worker",
        "description": "Scheduled merchant payouts.",
        "owner": "Payments",
        "team": "Payments",
        "category": "scheduled-job",
        "protocols": [
          "https",
          "grpc"
        ]
      }
    ],
    "serviceInstances": [
      {
        "id": "api-gateway.production",
        "serviceDefinitionId": "api-gateway",
        "environmentId": "production",
        "provider": "aws",
        "health": "healthy",
        "version": "3.14.2",
        "endpoint": "https://api.example.test",
        "resourceId": "ns-edge-prod",
        "metrics": {
          "latencyMs": 18,
          "throughputPerSecond": 2400,
          "errorRatePercent": 0.1,
          "isSimulated": true,
          "observedAt": "2026-10-11T06:00:00Z"
        },
        "updatedAt": "2026-10-11T06:00:00Z"
      },
      {
        "id": "web-bff.production",
        "serviceDefinitionId": "web-bff",
        "environmentId": "production",
        "provider": "aws",
        "health": "healthy",
        "version": "2.8.0",
        "resourceId": "ns-edge-prod",
        "metrics": {
          "latencyMs": 42,
          "throughputPerSecond": 1300,
          "errorRatePercent": 0.2,
          "isSimulated": true,
          "observedAt": "2026-10-11T06:00:00Z"
        },
        "updatedAt": "2026-10-11T06:00:00Z"
      },
      {
        "id": "auth-service.production",
        "serviceDefinitionId": "auth-service",
        "environmentId": "production",
        "provider": "aws",
        "health": "healthy",
        "version": "5.2.1",
        "resourceId": "ns-edge-prod",
        "metrics": {
          "latencyMs": 9,
          "throughputPerSecond": 900,
          "errorRatePercent": 0,
          "isSimulated": true,
          "observedAt": "2026-10-11T06:00:00Z"
        },
        "updatedAt": "2026-10-11T06:00:00Z"
      },
      {
        "id": "cart-service.production",
        "serviceDefinitionId": "cart-service",
        "environmentId": "production",
        "provider": "aws",
        "health": "healthy",
        "version": "1.19.0",
        "resourceId": "ns-commerce-prod",
        "metrics": {
          "latencyMs": 14,
          "throughputPerSecond": 610,
          "errorRatePercent": 0.1,
          "isSimulated": true,
          "observedAt": "2026-10-11T06:00:00Z"
        },
        "updatedAt": "2026-10-11T06:00:00Z"
      },
      {
        "id": "catalog-service.production",
        "serviceDefinitionId": "catalog-service",
        "environmentId": "production",
        "provider": "aws",
        "health": "healthy",
        "version": "4.3.0",
        "resourceId": "ns-commerce-prod",
        "metrics": {
          "latencyMs": 27,
          "throughputPerSecond": 1500,
          "errorRatePercent": 0.1,
          "isSimulated": true,
          "observedAt": "2026-10-11T06:00:00Z"
        },
        "updatedAt": "2026-10-11T06:00:00Z"
      },
      {
        "id": "order-service.production",
        "serviceDefinitionId": "order-service",
        "environmentId": "production",
        "provider": "aws",
        "health": "healthy",
        "version": "7.0.3",
        "resourceId": "ns-commerce-prod",
        "metrics": {
          "latencyMs": 64,
          "throughputPerSecond": 220,
          "errorRatePercent": 0.3,
          "isSimulated": true,
          "observedAt": "2026-10-11T06:00:00Z"
        },
        "updatedAt": "2026-10-11T06:00:00Z"
      },
      {
        "id": "inventory-service.production",
        "serviceDefinitionId": "inventory-service",
        "environmentId": "production",
        "provider": "aws",
        "health": "healthy",
        "version": "3.6.1",
        "resourceId": "ns-commerce-prod",
        "metrics": {
          "latencyMs": 210,
          "throughputPerSecond": 180,
          "errorRatePercent": 2.4,
          "isSimulated": true,
          "observedAt": "2026-10-11T06:00:00Z"
        },
        "updatedAt": "2026-10-11T06:00:00Z",
        "metadata": {
          "note": "p95 latency elevated; waiting on inventory-db replica"
        }
      },
      {
        "id": "notification-service.production",
        "serviceDefinitionId": "notification-service",
        "environmentId": "production",
        "provider": "on-prem",
        "health": "healthy",
        "version": "2.1.0",
        "resourceId": "ns-messaging-prod",
        "metrics": {
          "latencyMs": 0,
          "throughputPerSecond": 0,
          "errorRatePercent": 100,
          "isSimulated": true,
          "observedAt": "2026-10-11T06:00:00Z"
        },
        "updatedAt": "2026-10-11T06:00:00Z",
        "metadata": {
          "note": "2 of 4 replicas crash-looping"
        }
      },
      {
        "id": "legacy-report-cron.production",
        "serviceDefinitionId": "legacy-report-cron",
        "environmentId": "production",
        "provider": "on-prem",
        "health": "unknown",
        "version": "0.9.7",
        "resourceId": "ns-batch-prod",
        "updatedAt": "2026-10-11T06:00:00Z",
        "metadata": {
          "schedule": "0 2 * * *"
        }
      },
      {
        "id": "payment-service.production",
        "serviceDefinitionId": "payment-service",
        "environmentId": "production",
        "provider": "azure",
        "health": "healthy",
        "version": "6.2.0",